{
  "schemaVersion": "1.0",
  "packId": "campaign-fi-001",
  "locale": "fi-FI",
  "status": "contentPrototype",
  "cards": [
    {
      "id": "C001",
      "version": 1,
      "title": "Ensimmäinen rajaus",
      "body": "Kartalle mahtuu hanke. Kiinteistörajat eivät aivan noudata kartalle piirrettyä ajatusta. Aloitetaan yhteydenotoista.",
      "speakerId": "landowner",
      "artKey": "landowner",
      "phases": [
        "01"
      ],
      "modes": [
        "wind",
        "solar",
        "hybrid"
      ],
      "tone": "work",
      "trigger": "ambient",
      "weight": 10,
      "maxPerRun": 1,
      "requiresAll": [],
      "choices": {
        "left": {
          "label": "Neuvotellaan koko alueesta",
          "outcomeText": "Ratkaisu kirjataan hankkeen päätöshistoriaan.",
          "timeMonths": 1,
          "effects": [
            {
              "op": "adjust",
              "field": "budget",
              "value": -2
            },
            {
              "op": "adjust",
              "field": "quality",
              "value": 1
            }
          ],
          "delayed": []
        },
        "right": {
          "label": "Aloitetaan ydinalueesta",
          "outcomeText": "Ratkaisu kirjataan hankkeen päätöshistoriaan.",
          "timeMonths": 2,
          "effects": [
            {
              "op": "adjust",
              "field": "budget",
              "value": -1
            },
            {
              "op": "adjust",
              "field": "quality",
              "value": 1
            },
            {
              "op": "adjust",
              "field": "patience",
              "value": -1
            }
          ],
          "delayed": []
        }
      },
      "sourceIds": [],
      "authorNote": "Fiktiivinen mutta teoriassa mahdollinen tilanne. Pelin menettelymalli on erillinen kortin tekstistä."
    },
    {
      "id": "C002",
      "version": 1,
      "title": "Sama pelto, kolme omistajaa",
      "body": "Yksi omistajista on jo vastannut. Kaksi muuta eivät ole vielä nähneet sopimusluonnosta. Allekirjoituksille jätetty tila on optimistinen.",
      "speakerId": "landowner",
      "artKey": "landowner",
      "phases": [
        "01"
      ],
      "modes": [
        "wind",
        "solar",
        "hybrid"
      ],
      "tone": "work",
      "trigger": "ambient",
      "weight": 10,
      "maxPerRun": 1,
      "requiresAll": [],
      "choices": {
        "left": {
          "label": "Kootaan yhteinen neuvottelu",
          "outcomeText": "Ratkaisu kirjataan hankkeen päätöshistoriaan.",
          "timeMonths": 1,
          "effects": [
            {
              "op": "adjust",
              "field": "budget",
              "value": -2
            },
            {
              "op": "adjust",
              "field": "quality",
              "value": 1
            },
            {
              "op": "adjust",
              "field": "trust",
              "value": 2
            }
          ],
          "delayed": []
        },
        "right": {
          "label": "Käydään ehdot yksitellen",
          "outcomeText": "Ratkaisu kirjataan hankkeen päätöshistoriaan.",
          "timeMonths": 2,
          "effects": [
            {
              "op": "adjust",
              "field": "budget",
              "value": -1
            },
            {
              "op": "adjust",
              "field": "quality",
              "value": 1
            },
            {
              "op": "adjust",
              "field": "trust",
              "value": 2
            },
            {
              "op": "adjust",
              "field": "patience",
              "value": -1
            }
          ],
          "delayed": []
        }
      },
      "sourceIds": [],
      "authorNote": "Fiktiivinen mutta teoriassa mahdollinen tilanne. Pelin menettelymalli on erillinen kortin tekstistä."
    },
    {
      "id": "C003",
      "version": 1,
      "title": "Tie ei kuulu kauppaan",
      "body": "Vuokrattavalle alueelle pääsee tietä pitkin. Tieoikeuksien selvitys ei vielä vahvista, että sama koskee hankkeen liikennettä.",
      "speakerId": "consultant",
      "artKey": "consultant",
      "phases": [
        "01"
      ],
      "modes": [
        "wind",
        "solar",
        "hybrid"
      ],
      "tone": "work",
      "trigger": "ambient",
      "weight": 10,
      "maxPerRun": 1,
      "requiresAll": [],
      "choices": {
        "left": {
          "label": "Sovitaan kulkuoikeuksista nyt",
          "outcomeText": "Ratkaisu kirjataan hankkeen päätöshistoriaan.",
          "timeMonths": 1,
          "effects": [
            {
              "op": "adjust",
              "field": "budget",
              "value": -3
            },
            {
              "op": "adjust",
              "field": "quality",
              "value": 1
            }
          ],
          "delayed": []
        },
        "right": {
          "label": "Suunnitellaan toinen sisääntulo",
          "outcomeText": "Ratkaisu kirjataan hankkeen päätöshistoriaan.",
          "timeMonths": 2,
          "effects": [
            {
              "op": "adjust",
              "field": "budget",
              "value": -2
            },
            {
              "op": "adjust",
              "field": "quality",
              "value": 1
            },
            {
              "op": "adjust",
              "field": "patience",
              "value": -1
            }
          ],
          "delayed": []
        }
      },
      "sourceIds": [],
      "authorNote": "Fiktiivinen mutta teoriassa mahdollinen tilanne. Pelin menettelymalli on erillinen kortin tekstistä."
    },
    {
      "id": "C004",
      "version": 1,
      "title": "Sopimuksen pieni liite",
      "body": "Korvausperusteet on sovittu. Maanomistaja pyytää vielä liitettä alueen ennallistamisesta. Kukaan ei pidä pyyntöä huonona, vain myöhäisenä.",
      "speakerId": "landowner",
      "artKey": "landowner",
      "phases": [
        "01"
      ],
      "modes": [
        "wind",
        "solar",
        "hybrid"
      ],
      "tone": "work",
      "trigger": "ambient",
      "weight": 10,
      "maxPerRun": 1,
      "requiresAll": [],
      "choices": {
        "left": {
          "label": "Täsmennetään vastuut liitteeseen",
          "outcomeText": "Ratkaisu kirjataan hankkeen päätöshistoriaan.",
          "timeMonths": 0,
          "effects": [
            {
              "op": "adjust",
              "field": "budget",
              "value": -2
            },
            {
              "op": "adjust",
              "field": "quality",
              "value": 1
            }
          ],
          "delayed": []
        },
        "right": {
          "label": "Käydään ehdot yhdessä läpi",
          "outcomeText": "Ratkaisu kirjataan hankkeen päätöshistoriaan.",
          "timeMonths": 1,
          "effects": [
            {
              "op": "adjust",
              "field": "budget",
              "value": -1
            },
            {
              "op": "adjust",
              "field": "quality",
              "value": 1
            }
          ],
          "delayed": []
        }
      },
      "sourceIds": [],
      "authorNote": "Fiktiivinen mutta teoriassa mahdollinen tilanne. Pelin menettelymalli on erillinen kortin tekstistä."
    },
    {
      "id": "C005",
      "version": 1,
      "title": "Kartan oikea versio",
      "body": "Maanomistajan kartassa on viime viikon rajaus. Uudessa versiossa tie kulkee eri kohdasta. Molemmissa tiedostonimessä lukee uusi.",
      "speakerId": "consultant",
      "artKey": "consultant",
      "phases": [
        "01"
      ],
      "modes": [
        "wind",
        "solar",
        "hybrid"
      ],
      "tone": "work",
      "trigger": "ambient",
      "weight": 10,
      "maxPerRun": 1,
      "requiresAll": [],
      "choices": {
        "left": {
          "label": "Lähetetään muutoskartta",
          "outcomeText": "Ratkaisu kirjataan hankkeen päätöshistoriaan.",
          "timeMonths": 0,
          "effects": [
            {
              "op": "adjust",
              "field": "budget",
              "value": -1
            },
            {
              "op": "adjust",
              "field": "quality",
              "value": 1
            }
          ],
          "delayed": []
        },
        "right": {
          "label": "Käydään muutos yhdessä läpi",
          "outcomeText": "Ratkaisu kirjataan hankkeen päätöshistoriaan.",
          "timeMonths": 1,
          "effects": [
            {
              "op": "adjust",
              "field": "budget",
              "value": -1
            },
            {
              "op": "adjust",
              "field": "quality",
              "value": 1
            }
          ],
          "delayed": []
        }
      },
      "sourceIds": [],
      "authorNote": "Fiktiivinen mutta teoriassa mahdollinen tilanne. Pelin menettelymalli on erillinen kortin tekstistä."
    },
    {
      "id": "C006",
      "version": 1,
      "title": "Määräaika löytyy lopusta",
      "body": "Optio kattaa suunnitellun valmistelun. Jatkosta tarvitaan erillinen sopimus, jos selvityskalenteri venyy.",
      "speakerId": "landowner",
      "artKey": "landowner",
      "phases": [
        "01"
      ],
      "modes": [
        "wind",
        "solar",
        "hybrid"
      ],
      "tone": "work",
      "trigger": "ambient",
      "weight": 10,
      "maxPerRun": 1,
      "requiresAll": [],
      "choices": {
        "left": {
          "label": "Sovitaan jatkoehdot valmiiksi",
          "outcomeText": "Ratkaisu kirjataan hankkeen päätöshistoriaan.",
          "timeMonths": 0,
          "effects": [
            {
              "op": "adjust",
              "field": "budget",
              "value": -3
            },
            {
              "op": "adjust",
              "field": "quality",
              "value": 1
            }
          ],
          "delayed": []